{
  "schema_version": "8.0",
  "corpus_id": "AQ8-authoring",
  "split_nonce": "fcedacb4116091fe69d412a085fd40e350b8f1c7e70348dd3dd950d1752da1c2",
  "authority": {
    "h4": {
      "commit": "d6f9e6089e6e11f158a2d3bf4af717fc026548d4",
      "tree": "6b65ea1e125836c9ae684e869f1156e5750c7a0b",
      "components": [
        {
          "role": "authority",
          "path": "evals/foundation-v4/unresolved-decision-graph-authority-v8.json",
          "sha256": "3452f1ee7552549feac9a3f9d4d720eaae1b371177b5a4185596287ac98afd68"
        },
        {
          "role": "protocol",
          "path": "evals/foundation-v4/unresolved-decision-graph-protocol-v8.json",
          "sha256": "a145766c475de5ed1411bc86467a1a82c3cdaa18782b772ef00901238f590fd5"
        },
        {
          "role": "semantic_selector_schema",
          "path": "evals/foundation-v4/unresolved-decision-graph-selector-output-schema-v8.json",
          "sha256": "5ef3bd8dc5a1a83a25c51d10513607c17e298086450b00181caecac0dba35af4"
        },
        {
          "role": "runtime_selector_schema",
          "path": "evals/foundation-v4/unresolved-decision-graph-runtime-output-schema-v8.json",
          "sha256": "e4d58b46e39ac65e56a339e7c0d2714d536a5d517de57c2bcc34cfd5c6fe301e"
        },
        {
          "role": "condition_adapter",
          "path": "evals/foundation-v4/unresolved-decision-graph-condition-adapter-v8.json",
          "sha256": "2b82d26b9f438b7cfef712d59817bb2cc8426941167350ec58c42a9a6e5e5b31"
        },
        {
          "role": "reference_policy",
          "path": "evals/foundation-v4/unresolved-decision-graph-reference-policy-v8.json",
          "sha256": "e16ad13602a3540b97b608d6a70223e5c7061530b748a6843e007eea791826f4"
        }
      ],
      "active_parent_parser_projection": {
        "path": "explicit_constraint.h4_parent_parser_contract",
        "canonical_sha256": "8920ab58abd9618fb1af4894e1b664d76d3c6f478d335e1d61e08ac47b9360d1"
      }
    },
    "aq8_gate": {
      "commit": "953651815e76c56f0cf8d23d9eae9ef6a480726f",
      "tree": "83c5aa7ecd3930733071e509ba56d307ae49aa59",
      "path": "evals/foundation-v4/unresolved-decision-graph-gates-v8.json",
      "sha256": "d17c6de19b456100a0c930d9cbe898d123dab882fe924c92226f9962fc7784d8"
    },
    "base_candidate": {
      "commit": "f09a0544acf4b7a95fff796434273511a0683ca9",
      "tree": "38c8c8adf3bb633d33200df1ec65f33e985ae244",
      "path": "evals/foundation-v4/reduced-four-skills/candidate.json",
      "sha256": "854f67bdd03e7121bd20e5513ef61ac806d016b3a5f1d6e5891bf4d9e546eb1f"
    },
    "recorded_plan": {
      "commit": "b304aa09a8228b8c96e50a7c678a45baf84a7a49",
      "tree": "adbf28fdd11120f5a567e2be56eb90da21c4eafe"
    }
  },
  "claim_boundary": {
    "observation_state": "no-results",
    "replay_policy": "no-replay",
    "tuning_policy": "no-tuning",
    "failure_policy": "terminal-AQ8",
    "claim_ceiling": "structural-only",
    "runtime": false,
    "provider": false,
    "model": false,
    "sandbox": false,
    "product": false,
    "efficacy": false,
    "promotion": false,
    "authority": false,
    "effects": false,
    "external_action": false
  },
  "cases": [
    {
      "case_id": "AQ8-authoring-01",
      "case_nonce": "48ae296f79b92264bf43a3911bd8abffdc24ef280c2c215fca56985178b2a993",
      "task_text": "A database migration review is finished. The service boundary is fixed, the requested outcome and write authority are recorded, the proof plan has passed, and the follow-up lesson has already been accepted into the team's guidance. No decision or supporting reference remains open.",
      "task_text_nfc_sha256": "0873c6ea4beaf8f1e2ca8d917a6a2f76a41789847a2f7e39000995081861b6f9",
      "expected_semantic_output": {
        "candidate_states": [
          {
            "slot_id": "s0",
            "state": "resolved_or_absent"
          },
          {
            "slot_id": "s1",
            "state": "resolved_or_absent"
          },
          {
            "slot_id": "s2",
            "state": "resolved_or_absent"
          },
          {
            "slot_id": "s3",
            "state": "resolved_or_absent"
          }
        ],
        "pairwise_relations": [
          {
            "left_slot": "s0",
            "right_slot": "s1",
            "relation": "unrelated"
          },
          {
            "left_slot": "s0",
            "right_slot": "s2",
            "relation": "unrelated"
          },
          {
            "left_slot": "s0",
            "right_slot": "s3",
            "relation": "unrelated"
          },
          {
            "left_slot": "s1",
            "right_slot": "s2",
            "relation": "unrelated"
          },
          {
            "left_slot": "s1",
            "right_slot": "s3",
            "relation": "unrelated"
          },
          {
            "left_slot": "s2",
            "right_slot": "s3",
            "relation": "unrelated"
          }
        ],
        "reference_needs": [
          {
            "slot_id": "s0",
            "need": "none"
          },
          {
            "slot_id": "s1",
            "need": "none"
          },
          {
            "slot_id": "s2",
            "need": "none"
          },
          {
            "slot_id": "s3",
            "need": "none"
          }
        ]
      },
      "expected_parent_derivation": {
        "graph_status": "valid",
        "automatic_selection_status": "automatic",
        "selection_status": "automatic",
        "root_slots": [],
        "selected_slots": [],
        "selected_adviser_ids": [],
        "complement_adviser_ids": [
          "agentic-engineering",
          "codex-task-contract",
          "verification-strategy-engineering",
          "engineering-learning-loop"
        ],
        "reference_requests": [],
        "reference_uncertain_slots": [],
        "reference_resolution": {
          "status": "resolved",
          "resolved_count": 0,
          "canonical_payload_id_tuple": []
        }
      }
    },
    {
      "case_id": "AQ8-authoring-02",
      "case_nonce": "bd16f3ab94f4100f391d65b28adb04f6812b208f0350590041c4058f6af0a40a",
      "task_text": "A one-character documentation correction has already been merged after its prescribed diff check. It changes no system boundary, leaves no outcome or approval contract unsettled, calls for no new verification choice, and produced no observation that needs a governed learning change. No reference material is needed.",
      "task_text_nfc_sha256": "9044fc27b46793775bb8c7cd781c609b73d7b66eab92a8c67eff317a55075390",
      "expected_semantic_output": {
        "candidate_states": [
          {
            "slot_id": "s0",
            "state": "resolved_or_absent"
          },
          {
            "slot_id": "s1",
            "state": "resolved_or_absent"
          },
          {
            "slot_id": "s2",
            "state": "resolved_or_absent"
          },
          {
            "slot_id": "s3",
            "state": "resolved_or_absent"
          }
        ],
        "pairwise_relations": [
          {
            "left_slot": "s0",
            "right_slot": "s1",
            "relation": "unrelated"
          },
          {
            "left_slot": "s0",
            "right_slot": "s2",
            "relation": "unrelated"
          },
          {
            "left_slot": "s0",
            "right_slot": "s3",
            "relation": "unrelated"
          },
          {
            "left_slot": "s1",
            "right_slot": "s2",
            "relation": "unrelated"
          },
          {
            "left_slot": "s1",
            "right_slot": "s3",
            "relation": "unrelated"
          },
          {
            "left_slot": "s2",
            "right_slot": "s3",
            "relation": "unrelated"
          }
        ],
        "reference_needs": [
          {
            "slot_id": "s0",
            "need": "none"
          },
          {
            "slot_id": "s1",
            "need": "none"
          },
          {
            "slot_id": "s2",
            "need": "none"
          },
          {
            "slot_id": "s3",
            "need": "none"
          }
        ]
      },
      "expected_parent_derivation": {
        "graph_status": "valid",
        "automatic_selection_status": "automatic",
        "selection_status": "automatic",
        "root_slots": [],
        "selected_slots": [],
        "selected_adviser_ids": [],
        "complement_adviser_ids": [
          "agentic-engineering",
          "codex-task-contract",
          "verification-strategy-engineering",
          "engineering-learning-loop"
        ],
        "reference_requests": [],
        "reference_uncertain_slots": [],
        "reference_resolution": {
          "status": "resolved",
          "resolved_count": 0,
          "canonical_payload_id_tuple": []
        }
      }
    },
    {
      "case_id": "AQ8-authoring-03",
      "case_nonce": "40bc53503e55d3fedbe0810f3d1b3b8ec032d572b9e83a89023c2dd139d77769",
      "task_text": "Before replacing the queue worker, the team still must decide whether orchestration stays in one process or is split between a coordinator and workers. The requested outcome, authority limits, and completion evidence are already fixed; the proof plan is approved; and there is no prior outcome to convert into guidance. Material on choosing the smallest decomposition boundary is needed.",
      "task_text_nfc_sha256": "31d42ce3013e0f1e6ac2032ad358979a8f66e8de58bf11d4165aab691d9e7d59",
      "expected_semantic_output": {
        "candidate_states": [
          {
            "slot_id": "s0",
            "state": "unresolved"
          },
          {
            "slot_id": "s1",
            "state": "resolved_or_absent"
          },
          {
            "slot_id": "s2",
            "state": "resolved_or_absent"
          },
          {
            "slot_id": "s3",
            "state": "resolved_or_absent"
          }
        ],